group,sentence,construction
32,Tom coated Bob with some water.,with-applicative
32,Fred brushed Joseph with some acid.,with-applicative
32,Harry dabbed Eddie with some syrup.,with-applicative
32,Doug stained Dylan with some bleach.,with-applicative
33,Sam served George some coffee.,ditransitive
33,Jerry handed Bob some beer.,ditransitive
33,Harry brought Frank some tea.,ditransitive
33,Thomas offered Charlie some blood.,ditransitive
33,Aaron chucked some acid to Tom.,to-dative
33,Eddie threw some gin to Andrew.,to-dative
33,Joe sent some bleach to Mike.,to-dative
33,William passed some ink to Eric.,to-dative
33,Don sprayed some whisky on Paul.,caused-motion
33,Bill spilled some vodka on Bruce.,caused-motion
33,Doug dropped some water on James.,caused-motion
33,Michael sprinkled some wine on Fred.,caused-motion
33,Henry stained David with some shampoo.,with-applicative
33,Chris coated Dylan with some oil.,with-applicative
33,Jack dabbed Mark with some syrup.,with-applicative
33,Adam covered Jason with some soup.,with-applicative
34,Thomas sent Eddie some soda.,ditransitive
34,Michael served David some gasoline.,ditransitive
34,Mike brought Paul some oil.,ditransitive
34,John lent Frank some yogurt.,ditransitive
34,Bruce kicked some gin to Mark.,to-dative
34,Charlie passed some whisky to Don.,to-dative
34,Steve chucked some slime to Bill.,to-dative
34,Dylan tossed some beer to Jason.,to-dative
34,Adam sprayed some blood on Doug.,caused-motion
34,Eric spilled some honey on Joe.,caused-motion
34,Aaron sprinkled some cream on Bob.,caused-motion
34,George poured some paint on Tom.,caused-motion
34,James rubbed Henry with some water.,with-applicative
34,Edward coated Joseph with some acid.,with-applicative
34,Andrew dabbed William with some coffee.,with-applicative
34,Jack covered Chris with some ink.,with-applicative
35,David sent Dylan some juice.,ditransitive
35,Don threw Tom some vodka.,ditransitive
35,Bruce bought Andrew some yogurt.,ditransitive
35,Mark lent Adam some ink.,ditransitive
35,John gave some cream to Eric.,to-dative
35,Bill chucked some honey to Paul.,to-dative
35,William offered some oil to James.,to-dative
35,Michael brought some wine to Jason.,to-dative
35,Jack dropped some bleach on Frank.,caused-motion
35,Charlie splashed some blood on Harry.,caused-motion
35,Joe dumped some syrup on Mike.,caused-motion
35,Jerry poured some water on Steve.,caused-motion
35,Fred rubbed Doug with some milk.,with-applicative
35,Chris brushed Eddie with some paint.,with-applicative
35,Thomas sprayed Joseph with some shampoo.,with-applicative
35,Bob stained Edward with some gin.,with-applicative
36,Andrew passed David some slime.,ditransitive
36,Jerry gave Sam some gasoline.,ditransitive
36,Bill served John some soup.,ditransitive
36,Jason lent Edward some whisky.,ditransitive
36,Aaron tossed some wine to Harry.,to-dative
36,Chris offered some soda to Bob.,to-dative
36,George threw some gin to Mike.,to-dative
36,Jack sent some paint to Joe.,to-dative
36,Joseph sprinkled some milk on Steve.,caused-motion
36,Charlie spilled some syrup on Eddie.,caused-motion
36,Tom splashed some tea on William.,caused-motion
36,Mark dropped some ink on Paul.,caused-motion
36,Thomas covered Don with some beer.,with-applicative
36,Doug stained Dylan with some shampoo.,with-applicative
36,Bruce rubbed Adam with some oil.,with-applicative
36,Fred coated Henry with some blood.,with-applicative
37,Doug brought Henry some slime.,ditransitive
37,Tom bought Charlie some wine.,ditransitive
37,Mark sent Andrew some soda.,ditransitive
37,Harry handed Mike some milk.,ditransitive
37,Steve passed some acid to George.,to-dative
37,Paul tossed some beer to Aaron.,to-dative
37,Thomas chucked some bleach to William.,to-dative
37,Joe offered some tea to Chris.,to-dative
37,Bruce dumped some vodka on Fred.,caused-motion
37,Edward sprinkled some shampoo on Frank.,caused-motion
37,John sprayed some whisky on Joseph.,caused-motion
37,Don spilled some juice on Jerry.,caused-motion
37,Eric covered Sam with some blood.,with-applicative
37,Jack dabbed Dylan with some gin.,with-applicative
37,Bob stained James with some gasoline.,with-applicative
37,Bill coated Adam with some coffee.,with-applicative
38,Mike threw Sam some vodka.,ditransitive
38,David bought Frank some whisky.,ditransitive
38,Fred handed Jack some acid.,ditransitive
38,Mark lent Henry some yogurt.,ditransitive
38,Eddie passed some coffee to George.,to-dative
38,James offered some bleach to Eric.,to-dative
38,Doug kicked some milk to Andrew.,to-dative
38,Tom sent some water to Michael.,to-dative
38,Edward sprayed some slime on Adam.,caused-motion
38,Harry dumped some honey on Joe.,caused-motion
38,Jerry dropped some ink on Charlie.,caused-motion
38,Bob spilled some shampoo on Bill.,caused-motion
38,Paul stained Joseph with some wine.,with-applicative
38,Chris plastered Dylan with some juice.,with-applicative
38,Thomas dabbed John with some paint.,with-applicative
38,Don rubbed Jason with some soup.,with-applicative
39,Doug bought Tom some ink.,ditransitive
39,Jerry offered Charlie some gin.,ditransitive
39,Don threw Eric some milk.,ditransitive
39,Edward handed Jason some paint.,ditransitive
39,Fred sent some soup to Bob.,to-dative
39,James kicked some juice to Aaron.,to-dative
39,David tossed some water to Thomas.,to-dative
39,William chucked some syrup to Bill.,to-dative
39,Dylan dropped some soda on Joseph.,caused-motion
39,Chris splashed some gasoline on Eddie.,caused-motion
39,Michael poured some beer on George.,caused-motion
39,Harry sprinkled some oil on John.,caused-motion
39,Henry plastered Adam with some cream.,with-applicative
39,Joe covered Bruce with some tea.,with-applicative
39,Frank stained Mike with some wine.,with-applicative
39,Jack brushed Mark with some shampoo.,with-applicative
40,Chris served Adam some shampoo.,ditransitive
40,George brought Aaron some paint.,ditransitive
40,Mike handed Don some water.,ditransitive
40,Harry threw Jerry some cream.,ditransitive
40,Michael passed some ink to Eric.,to-dative
40,Eddie tossed some syrup to Mark.,to-dative
40,William sent some slime to Bill.,to-dative
40,Paul offered some oil to Bruce.,to-dative
40,Steve spilled some blood on Thomas.,caused-motion
40,Andrew poured some whisky on David.,caused-motion
40,James dumped some coffee on Jack.,caused-motion
40,Frank dropped some soda on Tom.,caused-motion
40,Charlie stained Jason with some beer.,with-applicative
40,John plastered Doug with some tea.,with-applicative
40,Edward rubbed Joseph with some bleach.,with-applicative
40,Bob sprayed Joe with some wine.,with-applicative
41,William sent Mike some beer.,ditransitive
41,Joseph threw Adam some acid.,ditransitive
41,Charlie brought Don some water.,ditransitive
41,Jason handed Eddie some bleach.,ditransitive
41,Edward kicked some soup to Jerry.,to-dative
41,Bruce tossed some syrup to Bill.,to-dative
41,Dylan chucked some wine to Steve.,to-dative
41,George gave some shampoo to Michael.,to-dative
41,Henry spilled some coffee on Doug.,caused-motion
41,John poured some cream on Aaron.,caused-motion
41,Thomas sprinkled some ink on Joe.,caused-motion
41,Andrew dropped some vodka on Chris.,caused-motion
41,Harry covered James with some gin.,with-applicative
41,Mark coated Frank with some whisky.,with-applicative
41,Fred sprayed Jack with some slime.,with-applicative
41,Paul stained Sam with some honey.,with-applicative
42,Bob sent James some cream.,ditransitive
42,Harry offered Henry some gin.,ditransitive
42,Don passed Paul some beer.,ditransitive
42,Eric threw Jerry some water.,ditransitive
42,Jason tossed some paint to Steve.,to-dative
42,Aaron chucked some wine to Andrew.,to-dative
42,Charlie handed some yogurt to Joe.,to-dative
42,Chris kicked some whisky to David.,to-dative
42,Doug dropped some bleach on Edward.,caused-motion
42,Bill splashed some oil on Tom.,caused-motion
42,Mike sprayed some acid on Thomas.,caused-motion
42,John spilled some juice on Mark.,caused-motion
42,Michael plastered Eddie with some ink.,with-applicative
42,Adam rubbed Fred with some vodka.,with-applicative
42,George dabbed Jack with some syrup.,with-applicative
42,Joseph coated Dylan with some coffee.,with-applicative
43,Fred threw Dylan some beer.,ditransitive
43,John lent Jack some soup.,ditransitive
43,Frank sent Joseph some acid.,ditransitive
43,Andrew bought Sam some wine.,ditransitive
43,Bob chucked some gasoline to Bill.,to-dative
43,Steve gave some bleach to Bruce.,to-dative
43,Henry offered some cream to Charlie.,to-dative
43,Doug kicked some shampoo to Mark.,to-dative
43,Tom sprinkled some paint on Jason.,caused-motion
43,Paul poured some coffee on Mike.,caused-motion
43,Aaron dropped some water on George.,caused-motion
43,Jerry sprayed some vodka on Don.,caused-motion
43,Harry brushed James with some milk.,with-applicative
43,David coated Chris with some slime.,with-applicative
43,Edward plastered Thomas with some syrup.,with-applicative
43,Eddie covered Adam with some gin.,with-applicative
44,Aaron offered Eric some milk.,ditransitive
44,Mark lent Joseph some tea.,ditransitive
44,Joe brought Steve some water.,ditransitive
44,Harry sent Jerry some bleach.,ditransitive
44,Bruce passed some beer to Adam.,to-dative
44,Charlie chucked some acid to Doug.,to-dative
44,Sam threw some coffee to David.,to-dative
44,James kicked some ink to Bill.,to-dative
44,George sprinkled some yogurt on Don.,caused-motion
44,Dylan poured some honey on Henry.,caused-motion
44,Tom spilled some gasoline on Jason.,caused-motion
44,Jack splashed some whisky on Eddie.,caused-motion
44,Andrew dabbed Michael with some soup.,with-applicative
44,Edward coated Fred with some oil.,with-applicative
44,Thomas plastered Chris with some syrup.,with-applicative
44,William rubbed Frank with some wine.,with-applicative
45,Aaron served Frank some paint.,ditransitive
45,Thomas lent Eddie some soda.,ditransitive
45,Jerry bought Michael some cream.,ditransitive
45,Mike threw Doug some wine.,ditransitive
45,David chucked some slime to John.,to-dative
45,Henry sent some bleach to Adam.,to-dative
45,Fred brought some beer to Joseph.,to-dative
45,Jack passed some tea to Bob.,to-dative
45,Eric splashed some whisky on Jason.,caused-motion
45,Bruce dropped some yogurt on George.,caused-motion
45,Dylan dumped some syrup on Harry.,caused-motion
45,Charlie poured some water on James.,caused-motion
45,Tom coated Edward with some shampoo.,with-applicative
45,William sprayed Steve with some blood.,with-applicative
45,Sam dabbed Chris with some acid.,with-applicative
45,Paul brushed Joe with some oil.,with-applicative
46,Tom offered Mark some tea.,ditransitive
46,George bought Joseph some acid.,ditransitive
46,Jack gave Chris some wine.,ditransitive
46,Harry lent Bob some slime.,ditransitive
46,Dylan handed some vodka to Eddie.,to-dative
46,David brought some milk to Thomas.,to-dative
46,Jason tossed some water to Sam.,to-dative
46,John kicked some juice to Aaron.,to-dative
46,Eric sprinkled some cream on Paul.,caused-motion
46,Andrew splashed some gin on Bruce.,caused-motion
46,Charlie poured some syrup on Don.,caused-motion
46,Mike dropped some soup on Steve.,caused-motion
46,Jerry sprayed Joe with some whisky.,with-applicative
46,Frank rubbed Doug with some yogurt.,with-applicative
46,James dabbed Henry with some coffee.,with-applicative
46,Adam plastered Fred with some oil.,with-applicative
47,Bruce passed Eric some gin.,ditransitive
47,Edward bought Aaron some tea.,ditransitive
47,Harry offered Adam some vodka.,ditransitive
47,John lent Paul some honey.,ditransitive
47,Doug chucked some soda to Charlie.,to-dative
47,Bob tossed some juice to Joseph.,to-dative
47,Eddie handed some milk to Chris.,to-dative
47,Frank threw some bleach to Tom.,to-dative
47,William sprayed some whisky on Thomas.,caused-motion
47,James sprinkled some oil on Mark.,caused-motion
47,David splashed some wine on Michael.,caused-motion
47,Andrew dropped some soup on Bill.,caused-motion
47,Sam coated Mike with some shampoo.,with-applicative
47,Jason covered Henry with some beer.,with-applicative
47,Steve stained Dylan with some cream.,with-applicative
47,Fred brushed Don with some slime.,with-applicative
48,Don gave Eddie some soup.,ditransitive
48,Jason bought Sam some water.,ditransitive
48,David served Adam some oil.,ditransitive
48,Harry passed Michael some syrup.,ditransitive
48,William handed some yogurt to Joe.,to-dative
48,Edward tossed some paint to George.,to-dative
48,Chris brought some cream to Dylan.,to-dative
48,Jerry offered some honey to Mike.,to-dative
48,John poured some gasoline on Steve.,caused-motion
48,Charlie spilled some bleach on Aaron.,caused-motion
48,Joseph sprinkled some whisky on Thomas.,caused-motion
48,Bob dumped some milk on Frank.,caused-motion
48,Eric stained Henry with some coffee.,with-applicative
48,Tom plastered Mark with some tea.,with-applicative
48,Jack dabbed James with some juice.,with-applicative
48,Paul brushed Andrew with some vodka.,with-applicative
49,Bruce handed Adam some gasoline.,ditransitive
49,Frank gave Andrew some coffee.,ditransitive
49,Mark served Jason some beer.,ditransitive
49,Edward passed Doug some oil.,ditransitive
49,Bob threw some soda to Bill.,to-dative
49,Paul offered some blood to Aaron.,to-dative
49,Joe chucked some shampoo to William.,to-dative
49,James kicked some cream to Don.,to-dative
49,John sprayed some juice on Thomas.,caused-motion
49,Jack poured some whisky on Michael.,caused-motion
49,Sam splashed some tea on Eddie.,caused-motion
49,Henry dumped some vodka on Fred.,caused-motion
49,Chris rubbed Tom with some paint.,with-applicative
49,George stained Jerry with some soup.,with-applicative
49,Harry plastered David with some wine.,with-applicative
49,Mike brushed Charlie with some water.,with-applicative
50,Joseph sent Paul some gasoline.,ditransitive
50,Don offered William some yogurt.,ditransitive
50,Mike threw John some water.,ditransitive
50,George passed Sam some soup.,ditransitive
50,Bob brought some soda to Harry.,to-dative
50,Doug chucked some ink to Henry.,to-dative
50,Thomas kicked some acid to Fred.,to-dative
50,Michael handed some cream to Aaron.,to-dative
50,Mark sprayed some honey on Eric.,caused-motion
50,Jerry spilled some blood on Chris.,caused-motion
50,Tom dropped some beer on Bill.,caused-motion
50,Eddie splashed some coffee on Dylan.,caused-motion
50,Jason stained Bruce with some tea.,with-applicative
50,Andrew covered James with some vodka.,with-applicative
50,David rubbed Charlie with some gin.,with-applicative
50,Edward brushed Adam with some paint.,with-applicative
51,Jason passed Paul some slime.,ditransitive
51,Joseph handed James some gasoline.,ditransitive
51,Michael lent William some water.,ditransitive
51,Mike gave David some blood.,ditransitive
51,Harry threw some acid to Jerry.,to-dative
51,Tom brought some coffee to Edward.,to-dative
51,Andrew tossed some yogurt to Bob.,to-dative
51,Jack sent some soda to Sam.,to-dative
51,Frank sprayed some whisky on Adam.,caused-motion
51,Aaron spilled some cream on Charlie.,caused-motion
51,Steve sprinkled some honey on Eric.,caused-motion
51,Mark dropped some shampoo on Chris.,caused-motion
51,Bruce stained George with some ink.,with-applicative
51,Fred dabbed Bill with some bleach.,with-applicative
51,Joe brushed Dylan with some wine.,with-applicative
51,Thomas coated Henry with some vodka.,with-applicative
52,Frank sent Steve some soup.,ditransitive
52,John handed Andrew some shampoo.,ditransitive
52,Tom brought Fred some whisky.,ditransitive
52,Bruce lent William some gin.,ditransitive
52,Dylan passed some gasoline to Joseph.,to-dative
52,Chris gave some syrup to Jerry.,to-dative
52,Doug tossed some honey to Harry.,to-dative
52,Mike chucked some slime to Bob.,to-dative
52,Mark sprinkled some juice on Eddie.,caused-motion
52,Edward spilled some bleach on Jack.,caused-motion
52,Joe splashed some milk on David.,caused-motion
52,Eric sprayed some water on Adam.,caused-motion
52,Henry coated James with some acid.,with-applicative
52,Michael rubbed Don with some beer.,with-applicative
52,Sam plastered Paul with some blood.,with-applicative
52,George dabbed Jason with some wine.,with-applicative
53,William brought Mark some soup.,ditransitive
53,Mike bought George some acid.,ditransitive
53,James threw Thomas some cream.,ditransitive
53,Dylan served Henry some gasoline.,ditransitive
53,Jack chucked some syrup to Bill.,to-dative
53,Tom kicked some bleach to Bob.,to-dative
53,Steve tossed some wine to Chris.,to-dative
53,Jason handed some slime to Eddie.,to-dative
53,Aaron sprayed some honey on David.,caused-motion
53,John dropped some water on Joe.,caused-motion
53,Sam sprinkled some juice on Paul.,caused-motion
53,Harry splashed some blood on Charlie.,caused-motion
53,Fred covered Don with some whisky.,with-applicative
53,Andrew coated Adam with some beer.,with-applicative
53,Bruce rubbed Michael with some shampoo.,with-applicative
53,Eric plastered Doug with some paint.,with-applicative
54,Tom passed Thomas some oil.,ditransitive
54,Don lent Jason some paint.,ditransitive
54,Doug sent Sam some bleach.,ditransitive
54,David brought Edward some water.,ditransitive
54,Charlie threw some wine to Bob.,to-dative
54,George handed some slime to Harry.,to-dative
54,William offered some gin to Eddie.,to-dative
54,Joe chucked some soup to Bill.,to-dative
54,Jerry sprinkled some honey on Adam.,caused-motion
54,Dylan poured some acid on Bruce.,caused-motion
54,Joseph dumped some whisky on Steve.,caused-motion
54,Jack sprayed some cream on Frank.,caused-motion
54,Mike rubbed John with some blood.,with-applicative
54,James dabbed Henry with some vodka.,with-applicative
54,Mark stained Aaron with some syrup.,with-applicative
54,Michael plastered Fred with some shampoo.,with-applicative
55,John bought William some water.,ditransitive
55,Charlie sent Joe some gasoline.,ditransitive
55,Dylan handed Bill some wine.,ditransitive
55,Sam gave Adam some whisky.,ditransitive
55,Aaron threw some slime to Joseph.,to-dative
55,Tom brought some beer to Bruce.,to-dative
55,George offered some tea to Doug.,to-dative
55,Bob tossed some blood to Thomas.,to-dative
55,Andrew poured some honey on David.,caused-motion
55,Jason dropped some ink on Edward.,caused-motion
55,Eric spilled some bleach on Don.,caused-motion
55,Frank dumped some yogurt on James.,caused-motion
55,Mike rubbed Steve with some soda.,with-applicative
55,Eddie brushed Harry with some milk.,with-applicative
55,Jack coated Paul with some cream.,with-applicative
55,Michael plastered Mark with some acid.,with-applicative
56,John lent Harry some milk.,ditransitive
56,Andrew passed Charlie some honey.,ditransitive
56,Jerry gave Joseph some ink.,ditransitive
56,Bill threw Jason some paint.,ditransitive
56,Adam sent some syrup to James.,to-dative
56,Michael tossed some oil to Frank.,to-dative
56,Henry brought some slime to Aaron.,to-dative
56,Sam chucked some gin to George.,to-dative
56,Tom dropped some beer on Edward.,caused-motion
56,Joe dumped some shampoo on Steve.,caused-motion
56,Jack splashed some whisky on Bruce.,caused-motion
56,Eddie sprinkled some soda on Chris.,caused-motion
56,Fred plastered Dylan with some water.,with-applicative
56,Mike coated Doug with some tea.,with-applicative
56,William rubbed David with some juice.,with-applicative
56,Mark sprayed Eric with some vodka.,with-applicative
57,Harry lent Frank some syrup.,ditransitive
57,Fred served Thomas some gasoline.,ditransitive
57,Jerry brought Doug some milk.,ditransitive
57,Eddie sent Aaron some cream.,ditransitive
57,Dylan kicked some yogurt to Adam.,to-dative
57,Edward chucked some oil to Joe.,to-dative
57,John tossed some tea to George.,to-dative
57,Joseph gave some ink to Paul.,to-dative
57,Mark dropped some juice on Eric.,caused-motion
57,Mike poured some water on William.,caused-motion
57,Jason sprayed some wine on Steve.,caused-motion
57,Sam spilled some slime on Andrew.,caused-motion
57,David dabbed Jack with some vodka.,with-applicative
57,Bob covered Don with some shampoo.,with-applicative
57,Tom plastered Michael with some paint.,with-applicative
57,Henry brushed Bruce with some honey.,with-applicative
58,George served Dylan some soda.,ditransitive
58,Bill threw Eric some cream.,ditransitive
58,Steve lent Paul some oil.,ditransitive
58,Andrew sent David some tea.,ditransitive
58,Adam tossed some syrup to Don.,to-dative
58,Fred handed some milk to Frank.,to-dative
58,Jason chucked some juice to Edward.,to-dative
58,Jerry kicked some wine to Mike.,to-dative
58,Harry dumped some soup on Thomas.,caused-motion
58,Eddie splashed some gasoline on Tom.,caused-motion
58,Chris sprayed some beer on Charlie.,caused-motion
58,Henry spilled some ink on John.,caused-motion
58,Bob dabbed Michael with some honey.,with-applicative
58,Bruce covered Doug with some whisky.,with-applicative
58,James plastered Sam with some vodka.,with-applicative
58,Jack stained Joseph with some paint.,with-applicative
59,George gave Harry some vodka.,ditransitive
59,Mike sent Henry some juice.,ditransitive
59,Michael served James some ink.,ditransitive
59,Eric offered Jason some blood.,ditransitive
59,Frank brought some syrup to Aaron.,to-dative
59,Steve tossed some tea to Andrew.,to-dative
59,Joseph handed some cream to Edward.,to-dative
59,Chris threw some beer to Eddie.,to-dative
59,Adam sprinkled some slime on Mark.,caused-motion
59,Thomas dumped some wine on Dylan.,caused-motion
59,Jack poured some coffee on Doug.,caused-motion
59,Tom spilled some yogurt on Paul.,caused-motion
59,Bill coated Charlie with some water.,with-applicative
59,William stained Joe with some milk.,with-applicative
59,Don plastered David with some gin.,with-applicative
59,Bruce brushed Jerry with some soup.,with-applicative
60,Chris lent Mike some gasoline.,ditransitive
60,Joseph offered Bruce some paint.,ditransitive
60,William gave Harry some honey.,ditransitive
60,Paul brought Jason some soup.,ditransitive
60,Joe handed some beer to John.,to-dative
60,Aaron threw some water to David.,to-dative
60,Thomas chucked some wine to Steve.,to-dative
60,Edward kicked some milk to Jerry.,to-dative
60,Fred sprinkled some shampoo on Adam.,caused-motion
60,Charlie sprayed some tea on Eric.,caused-motion
60,Sam spilled some gin on Tom.,caused-motion
60,Eddie splashed some oil on Andrew.,caused-motion
60,Mark covered Don with some whisky.,with-applicative
60,Jack rubbed Michael with some blood.,with-applicative
60,Dylan stained Henry with some soda.,with-applicative
60,Bill plastered James with some cream.,with-applicative
61,Eddie handed Bob some gin.,ditransitive
61,John bought Andrew some gasoline.,ditransitive
61,Paul brought Aaron some soup.,ditransitive
61,Mark served Bruce some beer.,ditransitive
61,Don gave some slime to Eric.,to-dative
61,Mike tossed some tea to Harry.,to-dative
61,Joe threw some oil to James.,to-dative
61,Jerry kicked some soda to William.,to-dative
61,Dylan dropped some water on Thomas.,caused-motion
61,Jack poured some vodka on Doug.,caused-motion
61,Tom sprinkled some honey on George.,caused-motion
61,Frank sprayed some shampoo on Edward.,caused-motion
61,Bill rubbed Sam with some cream.,with-applicative
61,Charlie dabbed Adam with some blood.,with-applicative
61,David stained Henry with some syrup.,with-applicative
61,Michael covered Joseph with some yogurt.,with-applicative
62,Frank sent Fred some vodka.,ditransitive
62,James served Doug some paint.,ditransitive
62,Tom lent Don some tea.,ditransitive
62,Joseph brought Steve some bleach.,ditransitive
62,Jason passed some juice to Henry.,to-dative
62,Paul offered some yogurt to Mark.,to-dative
62,Bob tossed some soda to Aaron.,to-dative
62,Edward threw some soup to Harry.,to-dative
62,Sam dumped some acid on Mike.,caused-motion
62,David sprinkled some honey on George.,caused-motion
62,Michael dropped some ink on Bill.,caused-motion
62,Jack spilled some wine on William.,caused-motion
62,Jerry brushed Adam with some oil.,with-applicative
62,Joe stained Dylan with some beer.,with-applicative
62,Eric sprayed Andrew with some coffee.,with-applicative
62,John coated Chris with some blood.,with-applicative
63,Henry lent Dylan some ink.,ditransitive
63,Jason handed Aaron some cream.,ditransitive
63,Joseph gave Eddie some wine.,ditransitive
63,Michael threw Charlie some syrup.,ditransitive
63,Jack tossed some tea to Frank.,to-dative
63,Mark sent some water to Bruce.,to-dative
63,Adam offered some beer to Don.,to-dative
63,Jerry passed some honey to Paul.,to-dative
63,Joe sprayed some coffee on William.,caused-motion
63,Doug spilled some whisky on Fred.,caused-motion
63,Edward dropped some soda on Chris.,caused-motion
63,Mike sprinkled some gasoline on George.,caused-motion
63,Tom plastered David with some blood.,with-applicative
63,Sam rubbed Thomas with some gin.,with-applicative
63,James stained John with some paint.,with-applicative
63,Andrew covered Bob with some shampoo.,with-applicative
64,William served Jack some honey.,ditransitive
64,Tom sent David some tea.,ditransitive
64,Henry passed Jerry some soup.,ditransitive
64,Andrew offered Steve some gin.,ditransitive
64,Doug handed some beer to Edward.,to-dative
64,Bruce threw some slime to John.,to-dative
64,Fred chucked some cream to Bill.,to-dative
64,Paul kicked some syrup to Aaron.,to-dative
64,Charlie dropped some juice on Thomas.,caused-motion
64,Mark splashed some vodka on Eric.,caused-motion
64,Harry poured some blood on Dylan.,caused-motion
64,Jason dumped some yogurt on Eddie.,caused-motion
64,Mike rubbed Bob with some milk.,with-applicative
64,Michael brushed Joseph with some wine.,with-applicative
64,Sam stained James with some oil.,with-applicative
64,Chris sprayed Don with some coffee.,with-applicative
65,Bill brought Frank some wine.,ditransitive
65,Eric bought Charlie some honey.,ditransitive
65,Paul passed James some blood.,ditransitive
65,William handed Jerry some juice.,ditransitive
