group,sentence,construction
97,Michael plastered Edward with some syrup.,with-applicative
97,Andrew brushed George with some paint.,with-applicative
97,Jason covered David with some whisky.,with-applicative
98,Aaron bought Michael some beer.,ditransitive
98,Fred sent Bob some shampoo.,ditransitive
98,Bruce threw Thomas some acid.,ditransitive
98,Edward brought Eddie some juice.,ditransitive
98,Bill chucked some yogurt to Mark.,to-dative
98,Don kicked some soup to William.,to-dative
98,Chris passed some milk to Steve.,to-dative
98,George tossed some bleach to Mike.,to-dative
98,Dylan dumped some water on Joe.,caused-motion
98,Joseph spilled some gin on Tom.,caused-motion
98,Sam sprayed some oil on Harry.,caused-motion
98,John splashed some cream on James.,caused-motion
98,Jason covered Frank with some gasoline.,with-applicative
98,Doug stained Paul with some wine.,with-applicative
98,Henry coated Adam with some soda.,with-applicative
98,David plastered Jerry with some coffee.,with-applicative
99,George passed Eddie some wine.,ditransitive
99,Chris gave Bob some yogurt.,ditransitive
99,Steve brought Jason some cream.,ditransitive
99,John threw Edward some milk.,ditransitive
99,Dylan chucked some paint to Jerry.,to-dative
99,David kicked some ink to Charlie.,to-dative
99,Thomas sent some bleach to Frank.,to-dative
99,Aaron tossed some blood to Sam.,to-dative
99,Don dumped some acid on Harry.,caused-motion
99,James dropped some whisky on Andrew.,caused-motion
99,Joe poured some soup on Bruce.,caused-motion
99,Joseph splashed some beer on Mark.,caused-motion
99,Jack dabbed Mike with some coffee.,with-applicative
99,Bill covered Henry with some shampoo.,with-applicative
99,Michael sprayed Adam with some vodka.,with-applicative
99,Fred coated William with some oil.,with-applicative
